iteration	description	time_s	keep	notes
0	baseline (ThreadPoolExecutor)	9.71	baseline	2 S3 HDF5 files, 69 cols, profiled bottleneck is h5py GIL
1	ProcessPoolExecutor (fork) for multi-file	4.57	keep	52% reduction; each process owns its h5py handle, bypasses GIL
2	Colnames fast-path (skip _index accessors)	4.18	keep	8% further reduction; read colnames attr to skip 5 _index columns (5x45ms=225ms saved/file)
3	fsspec blockcache 8MB	4.54	discard	WORSE: scattered HDF5 metadata → each 8MB HTTP fetch is larger than targeted range
4	h5coro batched metadata read (HTTPDriver)	2.38	keep	43% further reduction; 64 column metadata reads batched in one HTTP call (0.26s vs 2.88s serial). Boolean enum fallback to h5py.
5	Skip table.keys() using colnames+candidate_index	2.18	keep	~8% further reduction; 0.43s saved by skipping keys() call, net 0.29s/file gain
6	first_n_bytes=1MB fsspec first cache	2.06	discard	first_n_bytes silently ignored by FirstChunkCache; improvement was network noise
6	Concurrent h5coro open + 8MB fsspec block_size	1.60	keep	22% further reduction; 8MB block_size prevents 50MB over-fetch (50MB→0.95s, 8MB→0.37s/file open). 84% total from baseline.
